{
  "schemaVersion": "1.0",
  "id": "saycheck-tri-36",
  "title": "Trilingual voice commands — English / Malay / Chinese (36 utterances)",
  "description": "The same 12 intents spoken in English, Malay and Chinese, so recognition rates can be compared across languages on one robot. Audio is synthesised with macOS `say` (Samantha / Amira / Tingting) and regenerated by scripts/build_tri_suite.py.",
  "locale": "mul",
  "license": "CC-BY-4.0",
  "audioBase": "",
  "groups": [
    {
      "id": "g_en",
      "name": "英语 · English",
      "scene": "英语 · English 的同一批意图"
    },
    {
      "id": "g_ms",
      "name": "马来语 · Bahasa Melayu",
      "scene": "马来语 · Bahasa Melayu 的同一批意图"
    },
    {
      "id": "g_zh",
      "name": "中文 · Chinese",
      "scene": "中文 · Chinese 的同一批意图"
    }
  ],
  "defaults": {
    "rounds": 5,
    "gapMs": 1500,
    "windowMs": 5000,
    "settleMs": 900,
    "silenceMs": 1000,
    "rmsPeakDb": -34,
    "frameDiff": 3,
    "rule": "any",
    "recordFailedOnly": true
  },
  "utterances": [
    {
      "id": "en-01",
      "groupId": "g_en",
      "text": "Hello there, can you hear me",
      "translation": "greet · 唤醒后打招呼",
      "tags": [
        "lang:en",
        "intent:greet",
        "chars:28"
      ],
      "audio": {
        "path": "audio-tri/en-01.wav",
        "provider": "macos-say",
        "model": "Samantha",
        "languageId": "en-US",
        "sha256": "b706e9293ed7de4b6edc7ab544c1e2d27490e48dfebafa645f083cfb0a0076bf"
      }
    },
    {
      "id": "en-02",
      "groupId": "g_en",
      "text": "Please start the tour",
      "translation": "start · 请机器人开始导览",
      "tags": [
        "lang:en",
        "intent:start",
        "chars:21"
      ],
      "audio": {
        "path": "audio-tri/en-02.wav",
        "provider": "macos-say",
        "model": "Samantha",
        "languageId": "en-US",
        "sha256": "4e15b799a5793c76ae8274eed8b612634765dce098b39fc269aec897b5e4ccf0"
      }
    },
    {
      "id": "en-03",
      "groupId": "g_en",
      "text": "Tell me about the company",
      "translation": "company · 询问公司情况",
      "tags": [
        "lang:en",
        "intent:company",
        "chars:25"
      ],
      "audio": {
        "path": "audio-tri/en-03.wav",
        "provider": "macos-say",
        "model": "Samantha",
        "languageId": "en-US",
        "sha256": "3294643456c7587fbab94cd39702f0a388213383c0049fe468755e03743a8465"
      }
    },
    {
      "id": "en-04",
      "groupId": "g_en",
      "text": "What does the robot team do",
      "translation": "dept · 询问机器人部门",
      "tags": [
        "lang:en",
        "intent:dept",
        "chars:27"
      ],
      "audio": {
        "path": "audio-tri/en-04.wav",
        "provider": "macos-say",
        "model": "Samantha",
        "languageId": "en-US",
        "sha256": "a435b58ee775a22f765b32da3087061383ee3034388cadf5e0db32411faf8b59"
      }
    },
    {
      "id": "en-05",
      "groupId": "g_en",
      "text": "Show me a factory case",
      "translation": "case · 询问落地案例",
      "tags": [
        "lang:en",
        "intent:case",
        "chars:22"
      ],
      "audio": {
        "path": "audio-tri/en-05.wav",
        "provider": "macos-say",
        "model": "Samantha",
        "languageId": "en-US",
        "sha256": "79ff890b92e0cae1479c782873fa55a5a099c1f33cc878bc334dc65422e3638e"
      }
    },
    {
      "id": "en-06",
      "groupId": "g_en",
      "text": "Let us shake hands",
      "translation": "handshake · 主动请求握手",
      "tags": [
        "lang:en",
        "intent:handshake",
        "chars:18"
      ],
      "audio": {
        "path": "audio-tri/en-06.wav",
        "provider": "macos-say",
        "model": "Samantha",
        "languageId": "en-US",
        "sha256": "e72fd15aab74f4afce6e65dc8aea4c1f438d50e1b9b68e87a362d6dc6d259cc0"
      }
    },
    {
      "id": "en-07",
      "groupId": "g_en",
      "text": "Wave your hand please",
      "translation": "wave · 请求挥手",
      "tags": [
        "lang:en",
        "intent:wave",
        "chars:21"
      ],
      "audio": {
        "path": "audio-tri/en-07.wav",
        "provider": "macos-say",
        "model": "Samantha",
        "languageId": "en-US",
        "sha256": "fd99cf8e9b32a8cd647ac3335b1ceddb756712b174b40d452bf4a2f888399dac"
      }
    },
    {
      "id": "en-08",
      "groupId": "g_en",
      "text": "Please bow to us",
      "translation": "bow · 请求鞠躬",
      "tags": [
        "lang:en",
        "intent:bow",
        "chars:16"
      ],
      "audio": {
        "path": "audio-tri/en-08.wav",
        "provider": "macos-say",
        "model": "Samantha",
        "languageId": "en-US",
        "sha256": "cb1cf01d639bbd8231177fbe76c065582236db03cf0ab456f54c9442d826423d"
      }
    },
    {
      "id": "en-09",
      "groupId": "g_en",
      "text": "Thank you very much",
      "translation": "thanks · 道谢",
      "tags": [
        "lang:en",
        "intent:thanks",
        "chars:19"
      ],
      "audio": {
        "path": "audio-tri/en-09.wav",
        "provider": "macos-say",
        "model": "Samantha",
        "languageId": "en-US",
        "sha256": "9660311d77b4fcb9ee1cecbb38e44cce14981cc3fcd72cc7e8f7949fab6ef91e"
      }
    },
    {
      "id": "en-10",
      "groupId": "g_en",
      "text": "Take me to the meeting room",
      "translation": "guide · 请求带路",
      "tags": [
        "lang:en",
        "intent:guide",
        "chars:27"
      ],
      "audio": {
        "path": "audio-tri/en-10.wav",
        "provider": "macos-say",
        "model": "Samantha",
        "languageId": "en-US",
        "sha256": "f5486b9f9763dac420f607e9cd5b5da63c35731fcfa87160d6de3aba236f39ff"
      }
    },
    {
      "id": "en-11",
      "groupId": "g_en",
      "text": "Goodbye, see you next time",
      "translation": "bye · 告别",
      "tags": [
        "lang:en",
        "intent:bye",
        "chars:26"
      ],
      "audio": {
        "path": "audio-tri/en-11.wav",
        "provider": "macos-say",
        "model": "Samantha",
        "languageId": "en-US",
        "sha256": "557fff7d0ddef31e94982c717f220b7eb2eb223f07fe92bc113025de20dc4e6a"
      }
    },
    {
      "id": "en-12",
      "groupId": "g_en",
      "text": "Keep up the good work",
      "translation": "cheer · 鼓励机器人",
      "tags": [
        "lang:en",
        "intent:cheer",
        "chars:21"
      ],
      "audio": {
        "path": "audio-tri/en-12.wav",
        "provider": "macos-say",
        "model": "Samantha",
        "languageId": "en-US",
        "sha256": "a4fcd8f68610882cf3194ca073f79e9e21504b65fd3414b3a90d75e09a22a1af"
      }
    },
    {
      "id": "ms-01",
      "groupId": "g_ms",
      "text": "Helo, boleh dengar saya",
      "translation": "greet · 唤醒后打招呼",
      "tags": [
        "lang:ms",
        "intent:greet",
        "chars:23"
      ],
      "audio": {
        "path": "audio-tri/ms-01.wav",
        "provider": "macos-say",
        "model": "Amira",
        "languageId": "ms-MY",
        "sha256": "ce44ce131d702020db74ec01580f807736d0ada44c0b8f2c77d9226f9fd95d15"
      }
    },
    {
      "id": "ms-02",
      "groupId": "g_ms",
      "text": "Sila mulakan lawatan",
      "translation": "start · 请机器人开始导览",
      "tags": [
        "lang:ms",
        "intent:start",
        "chars:20"
      ],
      "audio": {
        "path": "audio-tri/ms-02.wav",
        "provider": "macos-say",
        "model": "Amira",
        "languageId": "ms-MY",
        "sha256": "1940802594b6554ab36bcccb1376b780fd3e16df8903aa1caba1953f27a41b0d"
      }
    },
    {
      "id": "ms-03",
      "groupId": "g_ms",
      "text": "Ceritakan tentang syarikat ini",
      "translation": "company · 询问公司情况",
      "tags": [
        "lang:ms",
        "intent:company",
        "chars:30"
      ],
      "audio": {
        "path": "audio-tri/ms-03.wav",
        "provider": "macos-say",
        "model": "Amira",
        "languageId": "ms-MY",
        "sha256": "ba42c10881b567f207be1231c0166f9b34a9c613666c2baff048eaa716347523"
      }
    },
    {
      "id": "ms-04",
      "groupId": "g_ms",
      "text": "Apa tugas pasukan robot",
      "translation": "dept · 询问机器人部门",
      "tags": [
        "lang:ms",
        "intent:dept",
        "chars:23"
      ],
      "audio": {
        "path": "audio-tri/ms-04.wav",
        "provider": "macos-say",
        "model": "Amira",
        "languageId": "ms-MY",
        "sha256": "9abd1342117307fbd47e339392ac12437e7cd2da7eedaded1f16417d9d7396e5"
      }
    },
    {
      "id": "ms-05",
      "groupId": "g_ms",
      "text": "Tunjukkan contoh di kilang",
      "translation": "case · 询问落地案例",
      "tags": [
        "lang:ms",
        "intent:case",
        "chars:26"
      ],
      "audio": {
        "path": "audio-tri/ms-05.wav",
        "provider": "macos-say",
        "model": "Amira",
        "languageId": "ms-MY",
        "sha256": "e5c50746bf876dda80b33398be2c89444a8c1d75d3481d35a5b55b7afa4a589c"
      }
    },
    {
      "id": "ms-06",
      "groupId": "g_ms",
      "text": "Mari berjabat tangan",
      "translation": "handshake · 主动请求握手",
      "tags": [
        "lang:ms",
        "intent:handshake",
        "chars:20"
      ],
      "audio": {
        "path": "audio-tri/ms-06.wav",
        "provider": "macos-say",
        "model": "Amira",
        "languageId": "ms-MY",
        "sha256": "4a675fe789b748b5b7eeaec4a5763e64af7d726982a23b8a3feb20ed30876929"
      }
    },
    {
      "id": "ms-07",
      "groupId": "g_ms",
      "text": "Lambai tangan anda",
      "translation": "wave · 请求挥手",
      "tags": [
        "lang:ms",
        "intent:wave",
        "chars:18"
      ],
      "audio": {
        "path": "audio-tri/ms-07.wav",
        "provider": "macos-say",
        "model": "Amira",
        "languageId": "ms-MY",
        "sha256": "ccac60d14e75ada191b74fce4f26cae1a047ccecdaa10be938da928829f94f44"
      }
    },
    {
      "id": "ms-08",
      "groupId": "g_ms",
      "text": "Tunduk hormat sedikit",